id,directory,filepath,function_name,description,input_parameters,returns
46,analysis,`myR/R/analysis/pathway/pathway_enrichment.R`,`myGO`,"GO, KEGG 및 GSEA 분석을 실행하고 결합된 결과를 반환합니다.","`deg_results`: 미분 식 결과가 있는 데이터 프레임, `run_go`: GO 분석 수행(기본값: TRUE), `run_kegg`: KEGG 분석 수행(기본값: TRUE), `run_gsea`: GSEA 수행(기본값: TRUE), `go_ont`: GO 온톨로지(기본값: ""BP""), `gsea_category`: GSEA용 MSigDB 카테고리(기본값: ""H""), `padj_threshold`: 유전자 선택을 위한 조정된 p-값 임계값(기본값: 0.05), `logfc_threshold`: 로그 폴드 변경 임계값(기본값: 0)",각 분석 방법의 결과가 포함된 목록
47,analysis,`myR/R/analysis/spatial/geomx_analysis.R`,`prepare_geomx_data`,표준 형식으로 정리하여 분석을 위한 원시 GeoMx 카운트 데이터를 준비합니다.,"카운트`: 카운트 행렬(유전자 x ROI), `metadata`: ROI 수준 메타데이터가 포함된 데이터 프레임, `feature_info`: 유전자/프로브 정보가 포함된 데이터 프레임(옵션)","포함 목록: 개수, 메타데이터, 기능"
48,analysis,`myR/R/analysis/spatial/geomx_analysis.R`,`q3_normalize`,GeoMx 카운트 데이터에 대해 Q3(3사분위수) 정규화를 수행합니다.,"geomx_data`: prepare_geomx_data 또는 카운트 행렬, `scale_factor`의 목록입니다: 정규화 후 스케일링 계수(기본값: 1000)",입력과 동일한 형식의 정규화된 데이터
49,analysis,`myR/R/analysis/spatial/geomx_analysis.R`,`perform_qc`,GeoMx 데이터에 대한 기본 품질 관리 검사 및 필터링을 수행합니다.,"geomx_data`: prepare_geomx_data, `min_counts`의 목록: ROI당 최소 총 개수(기본값: 1000), `min_genes`: ROI당 최소 검출된 유전자 수(기본값: 100), `min_rois`: 유전자를 발현하는 최소 ROI 수(기본값: 2)",메타데이터에 QC 메트릭이 추가된 필터링된 GeoMx 데이터 목록
50,analysis,`myR/R/analysis/spatial/geomx_analysis.R`,`find_deg_geomx`,림마 또는 윌콕슨 테스트를 사용하여 GeoMx 데이터에 대한 차등 표현식 분석을 수행합니다.,"geomx_data`: prepare_geomx_data(정규화된), `group_col`의 목록입니다: 그룹화를 위한 메타데이터 열, `비교`: 비교할 비교(예: c(""Treatment"", ""Control"")), `method`: 사용할 메서드: ""림마"" 또는 ""윌콕스""(기본값: ""림마""), `공변량`: 림마 모델에 포함할 공변량 열(선택 사항), `log_transform`: log2(x+1) 변환 적용(기본값: 림마의 경우 TRUE)",미분 표현식 결과가 포함된 데이터 프레임
51,analysis,`myR/R/analysis/spatial/geomx_analysis.R`,`.geomx_limma`,내부 림마 분석.,"`expr_data`: 표현식 데이터, `메타데이터`: 메타데이터, `group_col`: 그룹 열, `비교`: 비교, `공변량`: 공변량",림마 결과가 포함된 데이터 프레임
52,analysis,`myR/R/analysis/spatial/geomx_analysis.R`,`.geomx_wilcox`,내부 윌콕슨 테스트.,"`expr_data`: 표현식 데이터, `메타데이터`: 메타데이터, `group_col`: 그룹 열, `비교`: 비교",윌콕슨 결과가 포함된 데이터 프레임
53,analysis,`myR/R/analysis/spatial/geomx_analysis.R`,`plot_deg_volcano`,Creates a volcano plot from differential expression results.,"`deg_results`: Data frame from find_deg_geomx, `padj_threshold`: Adjusted p-value threshold (default: 0.05), `logfc_threshold`: Log fold change threshold (default: 1), `label_top`: Number of top genes to label (default: 10), `title`: Plot title",ggplot object
54,analysis,`myR/R/analysis/spatial/geomx_analysis.R`,`plot_deg_heatmap`,차별적으로 발현되는 상위 유전자에 대한 히트맵을 생성합니다.,"geomx_data`: GeoMx 데이터 목록(정규화된), `deg_results`: find_deg_geomx의 데이터 프레임, `group_col`: 그룹화를 위한 메타데이터 열, `n_genes`: 플롯할 상위 유전자 수(기본값: 50), `scale_rows`: Z-점수 스케일 행(기본값: TRUE)",히트맵(복합 히트맵 또는 히트맵 객체)
55,analysis,`myR/R/analysis/spatial/geomx_analysis.R`,`run_geomx_analysis`,래퍼 기능을 사용하여 전체 GeoMx 분석 워크플로우를 실행할 수 있습니다.,"raw_data`: 원시 데이터 행렬., `metadata_SP`: 메타데이터 데이터 프레임., `group_var`: 미분 표현식을 위한 열., `group1`: 비교를 위한 첫 번째 그룹, `group2`: 비교를 위한 두 번째 그룹(선택 사항)., `qc_filter`: QC 필터링 수행 (기본값: TRUE)., `min_genes`: ROI당 검출된 최소 유전자 수(기본값: 100), `min_counts`: ROI당 최소 총 개수(기본값: 1000).","처리된 데이터, DEG 결과 및 플롯이 포함된 목록입니다."
56,analysis,`myR/R/analysis/trajectory/trajectory_inference.R`,`run_slingshot_from_seurat`,Seurat 객체에서 새총 궤적 추론을 실행하고 계산된 궤적이 포함된 SingleCellExperiment 객체를 반환합니다.,"seurat_obj`: Seurat 객체, `cluster_col`: 메타데이터의 클러스터 열(기본값: ""seurat_clusters""), `reduction`: 사용할 차원 축소(기본값: ""umap""), `start_cluster`: 궤적의 시작 클러스터(선택 사항), `end_cluster`: 궤적의 종료 클러스터(선택 사항), `assay`: 사용할 분석(기본값: ""RNA""), `슬롯`: 사용할 슬롯(기본값: ""카운트"")",슬링샷 결과가 있는 SingleCellExperiment 개체
57,analysis,`myR/R/analysis/trajectory/trajectory_inference.R`,`analyze_gene_dynamics`,일반화된 가산 모델(GAM)을 적용하여 조건을 고려하여 유사 시간에 따른 유전자 발현 변화를 모델링합니다.,"`sce`: SingleCellExperiment object from run_slingshot_from_seurat, `gene`: Gene name to analyze, `condition`: Optional condition variable for comparison, `lineage`: Lineage number to analyze (default: 1), `plot`: Create plots (default: TRUE), `output_dir`: Directory for saving plots (optional)","List containing: model, summary, plot"
58,analysis,`myR/R/analysis/trajectory/trajectory_inference.R`,`process_gene_list_dynamics`,"Processes a list of genes using analyze_gene_dynamics, with optional parallel processing.","`sce`: SingleCellExperiment object, `genes`: Character vector of gene names, `condition`: Optional condition variable, `lineage`: Lineage number (default: 1), `plot`: Create plots (default: FALSE), `output_dir`: Directory for saving results, `n_cores`: Number of cores for parallel processing (default: 1)",List of results for each gene
59,analysis,`myR/R/analysis/trajectory/trajectory_inference.R`,`analyze_gene_dynamics_tradeSeq`,Fits GAMs using tradeSeq for differential expression patterns along trajectories.,"`sce`: SingleCellExperiment object from Slingshot, `gene`: Gene name to analyze, `n_knots`: Number of knots for spline (default: 6), `conditions`: Optional condition variable",List with test results
60,signatures,`myR/R/signatures/signature_discovery.R`,`find_gene_signature`,"Discovers gene signatures using multiple methods including Random Forest, LASSO, limma, NMF, Wilcoxon, GAM, and PCA.","`data`: Seurat object, count matrix, or data.frame, `meta.data`: Optional metadata data.frame (required if data is not Seurat), `target_var`: Column name in metadata representing the target variable, `target_group`: For numeric: quantile cutoff or list(low, high). For factor: levels to compare, `method`: One of: ""tree_based"", ""lasso"", ""limma"", ""nmf"", ""wilcoxon"", ""gam"", ""pca_loadings"", `n_features`: Number of top features to return (default: 50), `preprocess`: Whether to normalize/scale data (default: TRUE), `min_cells`: Minimum cells expressing gene (default: 10), `min_pct`: Minimum percentage of cells expressing gene (default: 0.01), `return_model`: Return full model object (default: FALSE), `seed`: Random seed for reproducibility (default: 42), `...`: Additional method-specific parameters","List containing: genes, weights, scores, performance, method, model"
61,signatures,`myR/R/signatures/signature_discovery.R`,`print.gene_signature`,유전자 서명 오브젝트에 대한 인쇄 메서드.,"`x`: gene_signature object, `...`: Additional arguments (unused)",None (prints to console)
62,signatures,`myR/R/signatures/signature_discovery.R`,`.find_signature_rf`,Internal helper for Random Forest signature discovery.,"`expr_mat`: Expression matrix, `target_binary`: Binary target vector, `n_features`: Number of features to return, `n_groups`: Number of groups, `return_model`: Whether to return the model",List of signature results
63,signatures,`myR/R/signatures/signature_discovery.R`,`.find_signature_lasso`,Internal helper for LASSO signature discovery.,"`expr_mat`: Expression matrix, `target_binary`: Binary target vector, `n_features`: Number of features to return, `n_groups`: Number of groups, `return_model`: Whether to return the model",List of signature results
64,signatures,`myR/R/signatures/signature_discovery.R`,`.find_signature_limma`,Internal helper for limma signature discovery.,"`expr_mat`: Expression matrix, `target_binary`: Binary target vector, `n_features`: Number of features to return, `n_groups`: Number of groups, `return_model`: Whether to return the model",List of signature results
65,signatures,`myR/R/signatures/signature_discovery.R`,`.find_signature_wilcoxon`,Internal helper for Wilcoxon signature discovery.,"`expr_mat`: Expression matrix, `target_binary`: Binary target vector, `n_features`: Number of features to return, `n_groups`: Number of groups",List of signature results
66,signatures,`myR/R/signatures/signature_discovery.R`,`.find_signature_nmf`,Internal helper for NMF signature discovery.,"`expr_mat`: Expression matrix, `target_binary`: Binary target vector, `n_features`: Number of features to return, `n_groups`: Number of groups, `return_model`: Whether to return the model",List of signature results
67,signatures,`myR/R/signatures/signature_discovery.R`,`.find_signature_gam`,Internal helper for GAM signature discovery.,"`expr_mat`: Expression matrix, `target_binary`: Binary target vector, `n_features`: Number of features to return, `n_groups`: Number of groups",List of signature results
68,signatures,`myR/R/signatures/signature_discovery.R`,`.find_signature_pca`,Internal helper for PCA loadings signature discovery.,"`expr_mat`: Expression matrix, `target_binary`: Binary target vector, `n_features`: Number of features to return, `n_groups`: Number of groups, `return_model`: Whether to return the model",List of signature results
69,signatures,`myR/R/signatures/signature_scoring.R`,`AddMultipleModuleScores`,"Calculates module scores for multiple gene sets using Seurat's AddModuleScore. Automatically handles naming and removes the default ""1"" suffix.","`seurat_object`: A Seurat object, `feature_sets`: Named or unnamed list of character vectors (gene sets), `assay`: Name of the assay to use (default: DefaultAssay), `slot`: Slot to pull expression data from (default: ""data""), `nbin`: Number of bins for AddModuleScore (default: 24), `ctrl`: Number of control features (default: 100), `seed`: Random seed (default: 1), `search`: Passed to Seurat::[.Assay (default: FALSE), `...`: Additional arguments passed to Seurat::AddModuleScore",Seurat object with added module scores in metadata
70,signatures,`myR/R/signatures/signature_scoring.R`,`add_signature_enrichit`,Calculates a gene signature score using escape::enrichIt and adds it to the Seurat object's metadata. Flexibly accepts different gene ID types.,"`seurat_obj`: A Seurat object, `gene_source`: File path, data.frame, or vector containing gene IDs, `signature_name`: Name for the new metadata column, `input_keytype`: Type of input gene IDs (default: ""ENSEMBL""), `gene_col`: Column index/name if gene_source is file or data.frame (default: 1), `sheet_name`: Sheet name/index if xlsx file (default: 1), `assay`: Assay to use (default: ""RNA""), `layer`: Layer (slot) to use (default: ""data""), `...`: Additional arguments passed to escape::enrichIt",Seurat object with signature score added to metadata
71,signatures,`myR/R/signatures/signature_scoring.R`,`add_progeny_scores`,Infers pathway activities using progeny and adds them to the Seurat object's metadata.,"`seurat_obj`: A Seurat object, `organism`: Organism: ""Human"" or ""Mouse"" (default: ""Human""), `topn`: Number of top genes per pathway (default: 100), `...`: Additional arguments passed to progeny::progeny",Seurat object with pathway activity scores in metadata
72,signatures,`myR/R/signatures/signature_scoring.R`,`score_signature`,Applies a gene signature (from find_gene_signature) to score new expression data.,"`expr_data`: Seurat object or expression matrix, `signature`: gene_signature object from find_gene_signature, `normalize`: Whether to z-score normalize scores (default: TRUE)",Named numeric vector of signature scores
73,utilities,`myR/R/utilities/demulti_utils.R`,`get_best_two`,Finds the two highest probabilities from a vector.,`probs`: Numeric vector of probabilities,"List containing: best, best_idx, second, second_idx"
74,utilities,`myR/R/utilities/demulti_utils.R`,`get_barcode_mapping`,Assigns barcodes (cell identities) to samples based on probability matrix.,"`prob_matrix`: Matrix where rows are cells and columns are samples, containing assignment probabilities, `singlet_threshold`: Minimum probability for singlet assignment (default: 0.5), `doublet_threshold`: Minimum probability for doublet assignment (default: 0.3), `return_probs`: Whether to return probability values (default: FALSE)","Data frame with columns: barcode, assignment, type, prob1, prob2"
75,utilities,`myR/R/utilities/demulti_utils.R`,`is_doublet`,"Determines if a sample identifier represents a doublet (contains ""+"").",`sample_name`: Character vector of sample names,Logical vector indicating doublet status
76,utilities,`myR/R/utilities/demulti_utils.R`,`generate_sample_values`,Creates a list of sample identifiers including both singlets and doublets.,"`n_samples`: Number of samples, `include_doublets`: Whether to include doublet combinations (default: TRUE), `prefix`: Prefix for sample names (default: ""Sample"")",Character vector of sample identifiers
77,utilities,`myR/R/utilities/demulti_utils.R`,`generate_sample_names`,Creates formatted sample name lists for display/plotting.,"`n_samples`: Number of samples, `format`: Format string with %d placeholder (default: ""Sample %d""), `include_doublets`: Whether to include doublet combinations (default: TRUE)",Character vector of formatted sample names
78,utilities,`myR/R/utilities/demulti_utils.R`,`parse_doublet_name`,Extracts the two sample identifiers from a doublet name.,"`doublet_name`: Character string representing a doublet (e.g., ""Sample1+Sample2""), `separator`: Character used to separate samples (default: ""+"")","Character vector of length 2 with the two sample names, or NULL if not a doublet"
79,utilities,`myR/R/utilities/demulti_utils.R`,`filter_demulti_results`,Filters barcode assignments based on type and quality criteria.,"`assignments`: Data frame from get_barcode_mapping, `keep_singlets`: Keep singlet assignments (default: TRUE), `keep_doublets`: Keep doublet assignments (default: FALSE), `keep_negative`: Keep negative/unassigned cells (default: FALSE), `min_prob`: Minimum probability threshold (if prob columns exist)",Filtered data frame
80,utilities,`myR/R/utilities/demulti_utils.R`,`summarize_demulti_results`,Generates summary statistics for demultiplexing results.,`assignments`: Data frame from get_barcode_mapping,"List containing: n_total, n_singlets, n_doublets, n_negative, doublet_rate, assignment_rate"
81,utilities,`myR/R/utilities/general_utils.R`,`downsample_sobj`,This function randomly samples cells from a Seurat object to create a smaller subset. The sampling is done without replacement and maintains the original data structure.,"`sobj`: A Seurat object to be downsampled, `ratio`: Integer indicating the downsampling ratio (1:ratio). Default is 10, meaning the output will contain 1/10th of the original cells, `seed`: Integer specifying the random seed for reproducibility. Default is 1234",A downsampled Seurat object containing a subset of cells from the input object
82,utilities,`myR/R/utilities/general_utils.R`,`printmy`,Convenience function to print marker genes in a format ready for copy-paste.,"`markers`: Data frame with marker gene results, `sign`: Sign of log2FC to print (""+"" for positive, ""-"" for negative), `num`: Number of genes to print (default: 100), `pseudobulk`: Whether markers are from pseudobulk analysis (uses ""logFC"" instead of ""avg_log2FC"")",Prints genes to console
83,utilities,`myR/R/utilities/general_utils.R`,`printMy`,Print marker genes from a named list of marker data frames.,"`markers_list`: Named list of marker data frames, `...`: Additional arguments passed to printmy()",Prints genes to console with list names as headers
84,utilities,`myR/R/utilities/general_utils.R`,`print_gene_combinations`,"For a list of gene sets, print genes that are unique to each combination (e.g., genes in A only, genes in A & B only, etc.)","`gene_list`: Named list of character vectors. Each element is a gene vector., `num_print`: Integer. Maximum number of genes to print per combination (default: 100).",None (prints to console)
85,utilities,`myR/R/utilities/general_utils.R`,`%||%`,첫 번째 NULL이 아닌 값을 반환합니다.,"`a`: First value, `b`: Second value (returned if a is NULL)","a if not NULL, otherwise b"
86,utilities,`myR/R/utilities/plot_utils.R`,`save_plot_with_conflict_resolution`,"Saves a plot to a file, automatically handling filename conflicts by appending a number to the filename if it already exists.","`plot_object`: ggplot2 object or other plot object, `base_filename`: Base filename (with extension), `output_dir`: Directory to save plot to, `width`: Plot width in inches, `height`: Plot height in inches, `dpi`: Resolution in dots per inch, `device`: Device to use for saving (auto-detected from extension if NULL)",The full path to the saved file
87,utilities,`myR/R/utilities/plot_utils.R`,`get_default_plot_dims`,Returns sensible default plot dimensions based on plot type.,"`plot_type`: Type of plot (""heatmap"", ""scatter"", ""boxplot"", ""default""), `n_items`: Number of items (e.g., genes, clusters) - used for sizing",List with width and height in inches
88,utilities,`myR/R/utilities/plot_utils.R`,`sanitize_filename`,Removes or replaces characters that are problematic in filenames.,"`filename`: Filename to sanitize, `replacement`: Character to replace problematic characters with (default: ""_"")",Sanitized filename
89,utilities,`myR/R/utilities/plot_utils.R`,`create_plot_grid`,Helper to calculate optimal grid layout dimensions.,"`n_plots`: Number of plots to arrange, `ncol`: Desired number of columns (if NULL, calculated automatically), `nrow`: Desired number of rows (if NULL, calculated automatically)",List with ncol and nrow
90,utilities,`myR/R/utilities/plot_utils.R`,`add_significance_stars`,Converts p-values to significance stars.,"`p_values`: Numeric vector of p-values, `thresholds`: Named vector of thresholds (default: c(""***""=0.001, ""**""=0.01, ""*""=0.05)), `ns_symbol`: Symbol for non-significant (default: ""ns"")",Character vector of significance symbols
91,utilities,`myR/R/utilities/plot_utils.R`,`get_color_palette`,Returns a color palette for consistent styling across plots.,"`name`: Palette name (""default"", ""viridis"", ""Set1"", ""custom""), `n`: Number of colors needed",Vector of color codes
92,utilities,`myR/R/utilities/sample_utils.R`,`sort_samples`,"Sorts character sample identifiers, handling both single-number and dual-number strings (e.g., ""1"", ""2+3"", ""10""). Numeric samples are sorted numerically, with doublets (containing ""+"") sorted after singlets.",`samples`: Character vector of sample identifiers,Sorted character vector of sample IDs
93,utilities,`myR/R/utilities/sample_utils.R`,`generate_sample_names`,Helper function to generate standardized sample names.,"`n_samples`: Number of samples to generate names for, `prefix`: Prefix for sample names (default: ""Sample""), `start_index`: Starting index (default: 1)",Character vector of sample names
94,utilities,`myR/R/utilities/sample_utils.R`,`parse_sample_ids`,Extracts numeric components from sample identifiers.,"`samples`: Character vector of sample identifiers, `return_doublets`: Whether to return doublet information","Data frame with columns: sample, numeric1, numeric2 (if doublet), is_doublet"
95,visualization,`myR/R/visualization/basic_plots.R`,`mybar`,Generates a histogram for a numeric vector or a column in a data frame.,"`x`: Numeric vector or data frame, `col`: If x is data frame, column name or index, `bins`: Number of bins (default: 30), `title`: Plot title, `xlab`: X-axis label, `color`: Fill color (default: ""steelblue"")",ggplot2 object
96,visualization,`myR/R/visualization/basic_plots.R`,`mydensity`,Generates a density plot for a numeric vector or a column in a data frame.,"`x`: Numeric vector or data frame, `col`: If x is data frame, column name or index, `title`: Plot title, `xlab`: X-axis label, `color`: Fill color (default: ""steelblue""), `alpha`: Transparency (default: 0.5)",ggplot2 object
97,visualization,`myR/R/visualization/basic_plots.R`,`myline`,Creates a line plot for a numeric vector with optional cutoff line.,"`vec`: Numeric vector, `cutoff`: Optional horizontal cutoff line value, `show_intersection`: Show intersection point with cutoff (default: TRUE), `title`: Plot title, `xlab`: X-axis label (default: ""Index""), `ylab`: Y-axis label (default: ""Value""), `color`: Line color (default: ""steelblue"")",ggplot2 object
98,visualization,`myR/R/visualization/basic_plots.R`,`mylines`,Creates a line plot for multiple numeric vectors with optional dual y-axis.,"`vec1`: First numeric vector, `vec2`: Second numeric vector (optional), `cutoff1`: Cutoff for vec1, `cutoff2`: Cutoff for vec2, `title`: Plot title, `ylab1`: Y-axis label for vec1, `ylab2`: Y-axis label for vec2, `color1`: Color for vec1 (default: ""steelblue""), `color2`: Color for vec2 (default: ""darkred"")",ggplot2 object
99,visualization,`myR/R/visualization/basic_plots.R`,`cdf`,"Computes and plots the CDF for probability, logit, or ratio values.","`values`: Numeric vector of values, `type`: Type of values: ""prob"", ""logit"", or ""ratio"" (default: ""prob""), `title`: Plot title, `xlab`: X-axis label, `color`: Line color (default: ""steelblue"")",ggplot2 object
100,visualization,`myR/R/visualization/basic_plots.R`,`cdf_multi`,Computes and plots CDFs across multiple or grouped datasets.,"`data_list`: List of numeric vectors or data frame with grouping column, `group_col`: If data is data.frame, column name for grouping, `value_col`: If data is data.frame, column name for values, `type`: Type of values: ""prob"", ""logit"", or ""ratio"" (default: ""prob""), `title`: Plot title, `xlab`: X-axis label",ggplot2 object
101,visualization,`myR/R/visualization/composition_plots.R`,`cmb`,Creates a proportional stacked bar graph of clusters across samples.,"`sobj`: Seurat object, `cluster_col`: Cluster identity column (default: ""seurat_clusters""), `sample_col`: Sample grouping column, `colors`: Color palette (optional), `title`: Plot title, `xlab`: X-axis label, `ylab`: Y-axis label (default: ""Proportion"")",ggplot2 object
102,visualization,`myR/R/visualization/composition_plots.R`,`acmb`,Creates an absolute count stacked bar graph of clusters across samples.,"`sobj`: Seurat object, `cluster_col`: Cluster identity column (default: ""seurat_clusters""), `sample_col`: Sample grouping column, `colors`: Color palette (optional), `title`: Plot title, `xlab`: X-axis label, `ylab`: Y-axis label (default: ""Cell Count"")",ggplot2 object
103,visualization,`myR/R/visualization/composition_plots.R`,`cml`,Produces a cumulative line plot of per-cluster cell proportions.,"`sobj`: Seurat object, `cluster_col`: Cluster identity column (default: ""seurat_clusters""), `sample_col`: Sample grouping column, `title`: Plot title, `xlab`: X-axis label (default: ""Sample""), `ylab`: Y-axis label (default: ""Cumulative Proportion"")",ggplot2 object
104,visualization,`myR/R/visualization/composition_plots.R`,`upset_gene_lists`,Creates an UpSet plot for visualizing intersections of multiple gene lists.,"`gene_lists`: Named list of character vectors (gene lists), `min_size`: Minimum intersection size to display (default: 0), `nsets`: Number of sets to display (default: all), `nintersects`: Number of intersections to display (default: 40), `order_by`: Order by: ""freq"" or ""degree"" (default: ""freq""), `...`: Additional arguments passed to UpSetR::upset",UpSet plot
105,visualization,`myR/R/visualization/composition_plots.R`,`vln_p`,Generates violin plots with statistical testing using ggpubr.,"`sobj`: Seurat object, `features`: Features to plot, `group_by`: Grouping variable, `split_by`: Optional splitting variable, `test_method`: Statistical test: ""wilcox"", ""t.test"", ""anova"", ""kruskal"" (default: ""wilcox""), `comparisons`: List of comparisons (default: all pairwise), `ncol`: Number of columns for faceting (default: NULL)",ggplot2 object
