id,directory,filepath,function_name,description,input_parameters,returns
106,deprecated,`myR/R/deprecated/pseudobulk_deg_standalone.R`,`prepare_pseudobulk_edgeR`,Aggregates single-cell counts to pseudo-bulk level for differential expression analysis.,"`object`: Seurat object, `sample_col`: Metadata column identifying samples/replicates, `group_col`: Metadata column for grouping (e.g., condition, treatment), `cluster_col`: Optional cluster column for per-cluster analysis (default: NULL), `target_cluster`: If cluster_col is specified, analyze only this cluster (default: NULL), `assay`: Assay to use (default: ""RNA""), `slot`: Slot to use (default: ""counts""), `min_cells`: Minimum cells per sample to include (default: 10), `min_counts`: Minimum total counts per gene (default: 10)","List containing: counts, metadata, cluster"
107,deprecated,`myR/R/deprecated/pseudobulk_deg_standalone.R`,`run_pseudobulk_deg`,Performs edgeR-based pseudo-bulk differential gene expression analysis.,"`object`: Seurat object or prepared pseudobulk list from prepare_pseudobulk_edgeR, `sample_col`: Metadata column identifying samples (required if object is Seurat), `group_col`: Metadata column for comparison (required if object is Seurat), `comparison`: Comparison to make (e.g., c(""Treatment"", ""Control"")), `cluster_col`: Optional cluster column (default: NULL), `target_cluster`: Specific cluster to analyze (default: NULL for overall), `mode`: Analysis mode: ""overall"", ""per_cluster"", ""specific_cluster"" (default: ""overall""), `assay`: Assay to use (default: ""RNA""), `slot`: Slot to use (default: ""counts""), `min_cells`: Minimum cells per sample (default: 10), `min_counts`: Minimum total counts per gene (default: 10), `fdr_threshold`: FDR threshold for significance (default: 0.05), `logfc_threshold`: Log fold change threshold (default: 0)","Data frame with differential expression results, or list of data frames if mode=""per_cluster"""
108,deprecated,`myR/R/deprecated/pseudobulk_deg_standalone.R`,`.run_edger_analysis`,Internal edgeR Analysis Function.,"`counts`: counts, `metadata`: metadata, `group_col`: group_col, `comparison`: comparison, `fdr_threshold`: fdr_threshold, `logfc_threshold`: logfc_threshold",Data frame with edgeR results
109,myR/R/,`myR/R/cluster_frequency.R`,`seurat_group_stats`,This function performs comprehensive statistical analysis on scRNA-seq data comparing groups across different categorical variables.,"`data`: A Seurat object or metadata dataframe, `grouping_var`: Character. Variable to group by (e.g., ""patient""), `categorizing_var`: Character. Dependent variable (e.g., ""seurat_clusters""), `comparative_var`: Character. Independent variable (e.g., ""condition"", ""smoking_status""), `test_use`: Character vector. Statistical tests to use, options: ""t"", ""u"", or both c(""t"", ""u""), `...`: Additional arguments (not used)",A data frame with statistical test results
110,myR/R/,`myR/R/cluster_frequency.R`,`seurat_posthoc_analysis`,This function performs post-hoc analysis based on results from seurat_group_stats.,"`data`: A Seurat object or metadata dataframe, `results`: Results dataframe from seurat_group_stats function, `alpha`: Significance level (default: 0.05)",A list of post-hoc test results
111,myR/R/,`myR/R/cluster_frequency.R`,`extract_sample_metadata`,Extract sample-level metadata from cell-level metadata,"`cell_metadata`: Cell-level metadata (Seurat object or data.frame), `sample_key`: Column name for sample identification, `target_key`: Column name for the target variable (e.g., cluster), `group_key`: Column name for grouping variable (e.g., prognosis), `fun`: Aggregation function (default: proportion calculation)",Data frame with sample-level aggregated data
112,myR/R/,`myR/R/cluster_frequency.R`,`perform_prior_tests`,Perform prior tests for statistical assumptions,"`data`: Data frame with sample-level data, `value_col`: Column name for the values to test, `group_col`: Column name for grouping variable",List with test results
113,myR/R/,`myR/R/cluster_frequency.R`,`plot_cluster_fractions`,Main function to create boxplot with statistical comparisons,"`sobj_metadata`: Seurat object or metadata data.frame, `sample_key`: Column name for sample identification, `cluster_key`: Column name for clusters, `group_key`: Column name for grouping (e.g., prognosis), `clusters_to_plot`: Vector of clusters to include (NULL for all), `groups_to_plot`: Vector of groups to include (NULL for all), `method`: Statistical test method, `prior_test`: Whether to perform prior tests, `palette`: Color palette for groups, `show_brackets`: Whether to show brackets for comparisons, `p_label_size`: Size of p-value labels, `...`: Additional arguments for ggplot",A list containing the ggplot object and a dataframe with statistics.
114,myR/R/,`myR/R/cluster_frequency.R`,`example_usage`,Example usage function for `plot_cluster_fractions`,,Prints a plot and statistics table.
115,myR/R/,`myR/R/cluster_frequency.R`,`calculate_sample_signatures`,Calculate custom signatures at sample level,"`seurat_obj`: Seurat object, `gene_sets`: Named list of gene sets, `sample_key`: Column name for sample identification, `method`: Scoring method (mean, ssgsea, etc.)",Data frame with sample-level signatures
116,myR/R/,`myR/R/cluster_frequency.R`,`adjust_confounders`,Adjust for confounding variables,"`data`: Data frame with sample-level data, `target_col`: Column name for target variable, `group_col`: Column name for grouping variable, `adjust_cols`: Vector of columns to adjust for, `method`: Adjustment method (residuals, stratification)",Adjusted data frame
117,myR/R/,`myR/R/cluster_frequency.R`,`add_simple_pvalues`,Add p-values without brackets (similar to first image style),"`plot_obj`: ggplot object, `stats_df`: Statistics dataframe, `plot_data`: Plot data with x_labels, `p_label_size`: Size of p-value text",Modified ggplot object
118,myR/R/,`myR/R/pseudotime.R`,`run_slingshot_from_seurat`,"This function takes a Seurat object (typically after PCA, UMAP, and clustering), runs Slingshot to infer trajectories, and returns a SingleCellExperiment object containing the Slingshot results (pseudotime and cell weights).","`seurat_obj`: A Seurat object., `cluster_col`: A character string specifying the column name in Seurat object's metadata that contains the cluster labels., `reduced_dim_name`: A character string specifying the name of the dimensionality reduction to use (e.g., ""UMAP"", ""PCA""). Default is ""UMAP""., `start_cluster`: A character string or numeric value specifying the identity of the starting cluster., `end_clusters`: Optional. A character vector or numeric vector specifying identities of known end clusters., `counts_assay_name`: Character string, the name of the assay in the Seurat object containing counts. Default is ""RNA""., `main_trajectory_only`: Logical. Placeholder for future implementation. Default is FALSE., `...`: Additional arguments to pass to `slingshot::slingshot()`.",A SingleCellExperiment object with Slingshot's results.
119,myR/R/,`myR/R/pseudotime.R`,`save_plot_with_conflict_resolution`,"Saves a plot to a file, automatically handling filename conflicts by appending a number to the filename if it already exists.","`plot_object`: ggplot2 object or other plot object., `base_filename`: Base filename (with extension)., `output_dir`: Directory to save plot to., `width`: Plot width in inches., `height`: Plot height in inches., `dpi`: Resolution in dots per inch.",The full path to the saved file.
120,myR/R/,`myR/R/pseudotime.R`,`analyze_gene_dynamics`,"This function fits a Generalized Additive Model (GAM) to model gene expression changes along pseudotime, potentially accounting for different conditions.","`gene_id`: A character string specifying the gene ID., `cds_obj`: A cell_data_set object from Monocle3., `condition_col_name`: A character string naming the column in `colData(cds_obj)` that contains the condition information., `pseudotime_method`: A function or character string to specify how pseudotime is extracted. Defaults to `monocle3::pseudotime`., `sample_col_name`: Optional. A character string naming the column for sample/patient IDs., `output_dir`: A character string specifying the directory to save plots., `k_val`: An integer, the number of basis functions for GAM splines., `min_cells_for_fit`: An integer, the minimum number of cells required to fit the GAM., `plot_split`: Logical, if TRUE, plots for different conditions will be faceted., `plot_width`: Width of the saved plot in inches., `plot_height`: Height of the saved plot in inches., `plot_dpi`: DPI of the saved plot., `scale_DR`: Logical, if TRUE, Dynamic Range (DR) will be scaled by the mean expression.","A list containing status, metrics, plot path, and the plot object."
121,myR/R/,`myR/R/pseudotime.R`,`process_gene_list_dynamics`,Helper to process a list of genes using `analyze_gene_dynamics`.,"`gene_list`: A character vector of gene IDs., `cds_obj`: A cell_data_set object from Monocle3., `condition_col_name`: Column name for conditions in `colData(cds_obj)`., `output_dir`: Directory to save plots., `num_cores`: Number of cores for parallel processing., `...`: Other arguments to pass to `analyze_gene_dynamics`.",A data.frame summarizing metrics for all successfully processed genes.
122,myR/R/,`myR/R/pseudotime.R`,`analyze_gene_dynamics_tradeSeq`,Fits GAMs using the tradeSeq framework for a specific gene and performs tests for differential progression or expression patterns along pseudotime trajectories.,"`gene_id`: A character string, the ID of the gene to analyze., `sce_obj`: A SingleCellExperiment object, typically output from `run_slingshot_from_seurat`., `condition_col`: A character string specifying the column name in `colData(sce_obj)` that contains the condition factor., `lineage_names`: A character vector specifying which lineages to test., `nknots`: An integer, the number of knots for GAM splines in `fitGAM`., `test_to_perform`: A character string. Currently supports ""patternTest""., `pseudotime_assay_name`: Character. Name of the reducedDim in SCE containing pseudotime. Default ""slingshot""., `weights_col_prefix`: Character. Prefix for colData columns containing cell weights. Default ""slingWeight""., `output_dir`: A character string specifying the directory to save plots., `plot_split`: Logical, if TRUE, plots for different conditions will be faceted. Default FALSE., `scale_DR`: Logical, if TRUE, Dynamic Range (DR) will be scaled by the mean expression., `fitGAM_args`: A list of additional arguments to pass to `tradeSeq::fitGAM`., `test_args`: A list of additional arguments to pass to the chosen test function.","A list containing status, metrics, plot path, and the plot object."
123,myR/R/,`myR/R/GeoMx.R`,`prepare_geomx_data`,Prepares raw GeoMx count data for analysis by organizing into a standard format.,"`raw_data`: Raw data matrix., `metadata_SP`: Metadata data frame.","List containing: expression, metadata, and gene_info."
124,myR/R/,`myR/R/GeoMx.R`,`q3_normalize`,Performs Q3 (third quartile) normalization on GeoMx count data.,"`expr_matrix`: Count matrix., `scaling_factor`: Scaling factor after normalization (default: 1000).",List containing normalized and log-normalized data.
125,myR/R/,`myR/R/GeoMx.R`,`perform_qc`,Performs basic QC checks and filtering on GeoMx data.,"`expr_matrix`: Count matrix., `metadata`: Metadata data frame.",List with QC metrics and plots.
126,myR/R/,`myR/R/GeoMx.R`,`find_deg_geomx`,Performs differential expression analysis on GeoMx data using limma or Wilcoxon test.,"`norm_expr`: Normalized expression matrix., `metadata`: Metadata data frame., `group_var`: Metadata column for grouping., `group1`: First group for comparison., `group2`: Second group for comparison (optional)., `method`: ""limma"" or ""wilcox"" (default: ""limma"")., `logFC_threshold`: Log fold change threshold (default: 0.5)., `pval_threshold`: P-value threshold (default: 0.05).",Data frame with differential expression results.
127,myR/R/,`myR/R/GeoMx.R`,`plot_deg_volcano`,Creates a volcano plot from differential expression results.,"`deg_results`: Data frame from `find_deg_geomx`., `title`: Plot title.",ggplot object.
128,myR/R/,`myR/R/GeoMx.R`,`plot_deg_heatmap`,Creates a heatmap of top differentially expressed genes.,"`norm_expr`: Normalized expression matrix., `deg_results`: Data frame from `find_deg_geomx`., `metadata`: Metadata data frame., `group_var`: Metadata column for grouping., `top_n`: Number of top genes to plot (default: 50)., `scale_rows`: Z-score scale rows (default: TRUE).",Heatmap plot.
129,myR/R/,`myR/R/GeoMx.R`,`run_geomx_analysis`,Wrapper function to run the complete GeoMx analysis workflow.,"`raw_data`: Raw data matrix., `metadata_SP`: Metadata data frame., `group_var`: Column for differential expression., `group1`: First group for comparison., `group2`: Second group for comparison (optional)., `qc_filter`: Perform QC filtering (default: TRUE)., `min_genes`: Minimum number of detected genes per ROI (default: 100)., `min_counts`: Minimum total counts per ROI (default: 1000).","List containing processed data, DEG results, and plots."
130,myR/R/,`myR/R/markers.R`,`marker_trim`,Filter and process marker genes from Seurat's FindMarkers or FindAllMarkers results.,"`markers`: A data frame from Seurat's FindMarkers or FindAllMarkers results., `sign`: Character string indicating the direction of log fold change to keep. Options: NULL (keep all), ""+"" (positive only), ""-"" (negative only)., `p_cutoff`: Numeric value for adjusted p-value cutoff. Default is NULL (no filtering)., `filter`: Additional filtering criteria (not used in this function).",A processed data frame with filtered markers and added pct.diff column.
131,myR/R/,`myR/R/markers.R`,`marker_filter`,Filter out unwanted genes from marker results.,"`markers`: A data frame from Seurat's FindMarkers or FindAllMarkers results., `filter`: Character vector specifying which gene types to filter out. Options: ""rb"", ""mt"", ""hb"", ""AC"", ""ENSG"", ""LINC"".",A filtered data frame with unwanted genes removed.
132,myR/R/,`myR/R/markers.R`,`lrf`,filterout (Intercept) terms.,`lmm_result`: The result from an LMM analysis.,"The LMM result with ""(Intercept)"" terms removed from the summary."
133,myR/R/,`myR/R/markers.R`,`all_markers_to_list`,Convert FindAllMarkers results to a list organized by cluster.,`markers`: A data frame from Seurat's FindAllMarkers results.,A list where each element is a data frame containing markers for one cluster.
134,myR/R/,`myR/R/markers.R`,`marker_print_all`,Print top marker genes for each cluster.,"`markers`: Either a list of marker data frames or a FindAllMarkers data frame., `n`: Integer specifying the number of top markers to print per cluster., `cluster_to_print`: Character vector specifying which clusters to print. If NULL, prints all clusters.",NULL (prints results to console).
135,myR/R/,`myR/R/markers.R`,`marker_print`,Print top n marker genes.,"`marker`: A marker data frame., `n`: Number of genes to print (default: 100)., `sign`: ""+"" for positive logFC, ""-"" for negative.",NULL (prints results to console).
136,myR/R/,`myR/R/markers.R`,`synthesize_markers`,Combines p-values and log fold changes from multiple FindMarkers results using Fisher's method for p-values and weighted mean for log fold changes.,"`marker_list`: Named list of marker data frames, `p_sig`: The p-value column to use for significance check (default: ""p_val_adj"").",Data frame with synthesized results
137,myR/R/,`myR/R/markers.R`,`synthesize_ranks`,Combines ranks from multiple FindMarkers results using geometric mean of ranks.,"`marker_list`: Named list of marker data frames, `rank_by`: Column to rank by (default: ""p_val"").",Data frame with synthesized ranks.
138,myR/R/,`myR/R/plots.R`,`mybar`,Generates a histogram for a numeric vector or a column in a data frame.,"`data`: Numeric vector or data frame., `column`: If data is data frame, column name or index., `bins`: Number of bins (default: NULL)., `x_unit`: Unit for x-axis label., `y_unit`: Unit for y-axis label., `xlab`: X-axis label., `main`: Plot title.",Prints a ggplot object.
139,myR/R/,`myR/R/plots.R`,`myline`,Creates a line plot for a single vector with cutoff intersection.,"`vector`: Numeric vector., `main`: Plot title., `ylab`: Y-axis label., `cutoff`: Optional horizontal cutoff line value., `cutoff_col`: Color for the cutoff line., `show_intersection`: Show intersection point with cutoff (default: TRUE)., `...`: Additional arguments to `plot()`.",A base R plot.
140,myR/R/,`myR/R/plots.R`,`mylines`,Creates a line plot for multiple numeric vectors with dual y-axis support.,"`...`: Numeric vectors for the left y-axis., `vectors_right`: A single vector or a list of vectors for the right y-axis., `main`: Plot title., `ylab`: Left y-axis label., `ylab_right`: Right y-axis label., `cutoff`: Cutoff for left y-axis vectors., `cutoff_right`: Cutoff for right y-axis vectors., `cutoff_col`: Color for the left cutoff line., `cutoff_col_right`: Color for the right cutoff line., `legend_pos`: Position of the legend., `show_intersection`: Show intersection points (default: TRUE).",A base R plot with multiple lines.
141,myR/R/,`myR/R/plots.R`,`find_and_mark_intersection`,Helper function to find and mark the intersection point on a line plot.,"`x_vals`: X values of the line., `y_vals`: Y values of the line., `cutoff`: The cutoff value., `col`: Color for the intersection point and label., `label_prefix`: Prefix for the intersection label.",Adds points and text to an existing plot.
142,myR/R/,`myR/R/plots.R`,`mydensity`,Generates a density plot for a numeric vector or a column in a data frame.,"`data`: Numeric vector or data frame., `column`: If data is data frame, column name or index., `adjust`: Bandwidth adjustment., `x_unit`: Unit for x-axis label., `y_unit`: Unit for y-axis label., `xlab`: X-axis label., `main`: Plot title.",Prints a ggplot object.
143,myR/R/,`myR/R/plots.R`,`mybox`,Generate boxplots of average feature expression from a Seurat object.,"`sobj`: A Seurat object., `features`: A character vector of features to plot., `sample_col`: The name of the metadata column identifying samples/patients., `group.by`: The name of the metadata column for primary grouping on the x-axis., `split.by`: The name of the metadata column for secondary grouping., `idents`: A character vector of values from the `group.by` column to include., `assay`: The assay to use for gene features., `layer`: The layer to use for gene features., `ncol`: Number of columns for arranging plots., `pt.size`: Size of points for individual sample averages., `violin`: Whether to overlay violin plots.",A ggplot object.
144,myR/R/,`myR/R/plots.R`,`mybox_df`,Generate boxplots of average feature values from a data frame.,"`df`: A data frame., `features`: A character vector of feature column names to plot., `sample_col`: The name of the column identifying samples/patients., `group.by`: The name of the column for primary grouping on the x-axis., `split.by`: The name of the column for secondary grouping., `idents`: A character vector of values from the `group.by` column to include., `ncol`: Number of columns for arranging plots., `pt.size`: Size of points for individual sample averages., `violin`: Whether to overlay violin plots.",A ggplot object.
145,myR/R/,`myR/R/plots.R`,`upset_gene_lists`,Creates an UpSet plot for visualizing intersections of multiple gene lists.,"`gene_lists`: Named list of character vectors (gene lists)., `sets`: Optional character vector to specify the order of sets., `min_size`: Minimum intersection size to display., `width_ratio`: Ratio of main plot and bar plot widths., `keep_sets`: Character vector of specific sets to include in the plot.",A ggplot object.
146,myR/R/,`myR/R/plots.R`,`vln_p`,Creates violin plots with statistical comparisons.,"`sobj`: Seurat object., `feature`: Features to plot., `group.by`: Grouping variable., `split.by`: Splitting variable., `pt.size`: Point size., `ncol`: Number of columns for faceting., `...`: Additional arguments passed to `VlnPlot`.",A ggplot object.
147,myR/R/,`myR/R/plots.R`,`cmb`,Creates a proportional stacked bar graph of clusters.,"`sobj`: A Seurat object., `identity`: The identity to use for clustering (default: ""seurat_clusters"")., `group.by`: The metadata column to group by (default: ""sample"")., `idents`: Which identities to include., `df`: If TRUE, returns the data frame used for plotting., `vlines`: X-axis positions for vertical lines., `vline_color`: Color for vertical lines.",A ggplot object or a data frame.
148,myR/R/,`myR/R/plots.R`,`acmb`,Creates an absolute count stacked bar graph of clusters.,"`sobj`: A Seurat object., `identity`: The identity to use for clustering (default: ""seurat_clusters"")., `group.by`: The metadata column to group by (default: ""sample"")., `idents`: Which identities to include., `df`: If TRUE, returns the data frame used for plotting., `vlines`: X-axis positions for vertical lines., `vline_color`: Color for vertical lines.",A ggplot object or a data frame.
149,myR/R/,`myR/R/plots.R`,`myhm_genesets2`,Creates a heatmap of gene set expression per cluster.,"`sobj`: A Seurat object., `group`: The identity to use for clustering., `value`: How to aggregate expression values (""average"" or ""sum"")., `assay`: Which assay to use., `gene_sets`: A list of character vectors (gene sets)., `title`: Plot title., `x_label`: X-axis label., `y_label`: Y-axis label.",A data frame with normalized expression values.
150,myR/R/,`myR/R/plots.R`,`myhm_genes2`,Creates a heatmap of individual gene expression per cluster.,"`sobj`: A Seurat object., `group`: The identity to use for clustering., `value`: How to aggregate expression values (""average"" or ""sum"")., `assay`: Which assay to use., `genes`: Character vector of gene names to plot., `title`: Plot title., `x_label`: X-axis label., `y_label`: Y-axis label.",A data frame with normalized expression values.
151,myR/R/,`myR/R/plots.R`,`cml`,Produces a cumulative line plot of per-cluster cell proportions.,"`sobj`: A Seurat object., `cluster_col`: Metadata column with cluster IDs., `group.by`: Metadata column for grouping., `sort.by`: Cluster ordering strategy (""name"" or ""frequency"")., `df`: If TRUE, returns the data frame used for plotting., `color_palette`: Optional vector of colors., `n_patterns`, `n_shapes`: Number of linetypes/shapes to cycle.",A ggplot object or a data frame.
152,myR/R/,`myR/R/plots.R`,`cdf`,Computes and plots the Cumulative Distribution Function (CDF).,"`data`: A data frame., `probability_col`: Column with probability values., `ratio_col`: Column with probability ratio values., `plot_type`: ""probability"", ""logit"", or ""ratio""., `output_file`: Path to save the plot.",A list with the ggplot object and a summary data frame.
153,myR/R/,`myR/R/plots.R`,`cdf_multi`,Computes and plots CDFs across multiple or grouped datasets.,"`data_list`: A data frame or a list of data frames., `probability_col`: Column with probability values., `ratio_col`: Column with probability ratio values., `plot_type`: ""probability"", ""logit"", or ""ratio""., `group_by_col`: Column to group by if `data_list` is a single data frame., `sample_col`: Column to name datasets., `output_file`: Path to save the plot.",A list with the ggplot object and a summary data frame.
154,myR/R/,`myR/R/plots.R`,`scatter_smooth_colored`,Averaged Expression vs Numeric Covariate (with optional colour).,"`object`: A Seurat object or a data.frame., `feature`: Gene symbol or expression column name., `group.by`: Column used to aggregate cells into samples., `x_var`: Column providing the numeric predictor per cell., `transpose`: If TRUE, swap X and Y axes., `color_by`: Column name to color points., `palette`: Optional palette vector/name., `transparency`: Map `color_by` (numeric only) to point alpha., `transparency_desc`: If TRUE, higher values become more transparent., `fitted_line`: ""linear"", ""loess"", ""lasso"", or NULL.",A ggplot scatter-smooth plot.
155,myR/R/,`myR/R/plots.R`,`mybox_geomx`,Generate boxplots of average feature values from GeoMx data.,"`data_norm`: Normalized data matrix., `metadata`: Metadata data frame., `features`: A character vector of feature column names to plot., `group.by`: The name of the column for primary grouping., `split.by`: The name of the column for secondary grouping., `test_method`: ""t.test"" or ""wilcox.test""., `p_adjust_method`: P-value adjustment method., `hide_ns`: Hide non-significant p-values., `show_points`: Show individual data points., `comparisons`: ""all"" or a list of specific comparisons.",Prints ggplot objects and invisibly returns a list of statistical results.
156,myR/R/,`myR/R/plots.R`,`myhm_genesets4`,Creates a heatmap of gene set expression per cluster (version 4).,"`sobj`: A Seurat object., `group`: The identity to use for clustering., `value`: How to aggregate expression values (""average"" or ""sum"")., `assay`: Which assay to use., `gene_sets`: A list of character vectors (gene sets)., `title`: Plot title., `x_label`: X-axis label., `y_label`: Y-axis label.",A data frame with normalized expression values.
157,myR/R/,`myR/R/plots.R`,`myhm_genes4`,Creates a heatmap of individual gene expression per cluster (version 4).,"`sobj`: A Seurat object., `group`: The identity to use for clustering., `value`: How to aggregate expression values (""average"" or ""sum"")., `assay`: Which assay to use., `genes`: Character vector of gene names to plot., `title`: Plot title., `x_label`: X-axis label., `y_label`: Y-axis label.",A data frame with normalized expression values.
158,myR/R/,`myR/R/plots.R`,`%||%`,NULL coalescing operator.,"`a`: First value., `b`: Second value.","`a` if not NULL, otherwise `b`."
